Ubisoft Apologizes For Assassin's Creed,http://rss.slashdot.org/~r/Slashdot/slashdot/~3/wIaF0272eLk/story01.htm,"BarbaraHudson writes in with the latest in the Assassin's Creed Unity debacle. This time it's good news. ""As an acknowledgment of the botched launch of Assassin's Creed Unity, Ubisoft has offered free additional content to everyone who purchased the title, cancelled the game's season pass and offered a free game to users who purchased the pass. The anticipation for Assassin's Creed Unity was such that the myriad of bugs and technical issues experienced at launch felt like an even greater slap in the face for gamers. In a blog posted yesterday, Yannis Mallat, CEO of Ubisoft Montreal &amp; Toronto said: 'Unfortunately, at launch, the overall quality of the game was diminished by bugs and unexpected technical issues. I want to sincerely apologize on behalf of Ubisoft and the entire Assassin's Creed team. These problems took away from your enjoyment of the game, and kept many of you from experiencing the game at its fullest potential.'""<p><div class=""share_submission"" style=""position:relative;""> <a class=""slashpop"" href=""http://twitter.com/home?status=Ubisoft+Apologizes+For+Assassin's+Creed%3A+http%3A%2F%2Fbit.ly%2F1z1OHHw""><img src=""http://a.fsdn.com/sd/twitter_icon_large.png""></a> <a class=""slashpop"" href=""http://www.facebook.com/sharer.php?u=http%3A%2F%2Fgames.slashdot.org%2Fstory%2F14%2F11%2F28%2F0356245%2Fubisoft-apologizes-for-assassins-creed%3Futm_source%3Dslashdot%26utm_medium%3Dfacebook""><img src=""http://a.fsdn.com/sd/facebook_icon_large.png""></a> <a class=""nobg"" href=""http://plus.google.com/share?url=http://games.slashdot.org/story/14/11/28/0356245/ubisoft-apologizes-for-assassins-creed?utm_source=slashdot&amp;utm_medium=googleplus"" onclick=""javascript:window.open(this.href,'', 'menubar=no,toolbar=no,resizable=yes,scrollbars=yes,height=600,width=600');return false;""><img src=""http://www.gstatic.com/images/icons/gplus-16.png"" alt=""Share on Google+""/></a> </div></p><p><a href=""http://games.slashdot.org/story/14/11/28/0356245/ubisoft-apologizes-for-assassins-creed?utm_source=rss1.0moreanon&amp;utm_medium=feed"">Read more of this story</a> at Slashdot.</p><iframe src=""http://slashdot.org/slashdot-it.pl?op=discuss&amp;id=6214233&amp;smallembed=1"" style=""height: 300px; width: 100%; border: none;""></iframe><img width='1' height='1' src='http://slashdot.feedsportal.com/c/35028/f/647410/s/40ecf092/sc/23/mf.gif' border='0'/><br clear='all'/><br/><br/><a href=""http://da.feedsportal.com/r/214612177454/u/0/f/647410/c/35028/s/40ecf092/sc/23/rc/1/rc.htm"" rel=""nofollow""><img src=""http://da.feedsportal.com/r/214612177454/u/0/f/647410/c/35028/s/40ecf092/sc/23/rc/1/rc.img"" border=""0""/></a><br/><a href=""http://da.feedsportal.com/r/214612177454/u/0/f/647410/c/35028/s/40ecf092/sc/23/rc/2/rc.htm"" rel=""nofollow""><img src=""http://da.feedsportal.com/r/214612177454/u/0/f/647410/c/35028/s/40ecf092/sc/23/rc/2/rc.img"" border=""0""/></a><br/><a href=""http://da.feedsportal.com/r/214612177454/u/0/f/647410/c/35028/s/40ecf092/sc/23/rc/3/rc.htm"" rel=""nofollow""><img src=""http://da.feedsportal.com/r/214612177454/u/0/f/647410/c/35028/s/40ecf092/sc/23/rc/3/rc.img"" border=""0""/></a><br/><br/><a href=""http://da.feedsportal.com/r/214612177454/u/0/f/647410/c/35028/s/40ecf092/sc/23/a2.htm""><img src=""http://da.feedsportal.com/r/214612177454/u/0/f/647410/c/35028/s/40ecf092/sc/23/a2.img"" border=""0""/></a><img width=""1"" height=""1"" src=""http://pi.feedsportal.com/r/214612177454/u/0/f/647410/c/35028/s/40ecf092/sc/23/a2t.img"" border=""0""/><img src=""http://feeds.feedburner.com/~r/Slashdot/slashdot/~4/wIaF0272eLk"" height=""1"" width=""1""/>"
Victorian renewable energy companies 'cut nearly one in 10 jobs' (climateark),http://news.feedzilla.com/en_us/stories/science/409132040?client_source=api&format=json,"Guardian: Melbourne’s leading renewable energy companies have cut nearly one
in 10 jobs over the past year owing to uncertainty in the sector, according to
an environment group that is calling on Victorian Labor to implement a state-
based renewables target if it wins power. A survey of 15 clean energy
businesses found that overall job numbers fell from 556 in 2013 to 507 in
2014, representing a 9% drop. Friends of the Earth, which conducted the poll,
said the job losses were due to uncertainty about...

"
Vivid Dreams Comfort the Dying (Scientific American),http://news.feedzilla.com/en_us/stories/science/409071593?client_source=api&format=json,"Memorable visions at the end of life are more than just delirium


-- Read more on ScientificAmerican.com

"
Volcanic Eruption In Japan Disrupts Flights,http://rss.slashdot.org/~r/Slashdot/slashdot/~3/Ldu8HY3mULM/story01.htm,"An anonymous reader writes: A volcano in southern Japan erupted today, sending out chunks of magma and a kilometer-high plume of ash. Flights to and from the nearby city of Kumamoto were canceled, and a Japan Airlines spokesman said more could be disrupted if the eruption continues. ""Mount Aso, whose huge caldera dominates the southwestern main island of Kyushu, rumbled into life on Tuesday. Meteorologists warned volcanic stones and ash could fall in a one-kilometer radius of the volcano. The eruption is Aso's first in 19 years and comes two months after Mount Ontake in central Nagano killed more than 60 hikers when it erupted without warning.""<p><div class=""share_submission"" style=""position:relative;""> <a class=""slashpop"" href=""http://twitter.com/home?status=Volcanic+Eruption+In+Japan+Disrupts+Flights%3A+http%3A%2F%2Fbit.ly%2F1vt4QoM""><img src=""http://a.fsdn.com/sd/twitter_icon_large.png""></a> <a class=""slashpop"" href=""http://www.facebook.com/sharer.php?u=http%3A%2F%2Fnews.slashdot.org%2Fstory%2F14%2F11%2F28%2F143200%2Fvolcanic-eruption-in-japan-disrupts-flights%3Futm_source%3Dslashdot%26utm_medium%3Dfacebook""><img src=""http://a.fsdn.com/sd/facebook_icon_large.png""></a> <a class=""nobg"" href=""http://plus.google.com/share?url=http://news.slashdot.org/story/14/11/28/143200/volcanic-eruption-in-japan-disrupts-flights?utm_source=slashdot&amp;utm_medium=googleplus"" onclick=""javascript:window.open(this.href,'', 'menubar=no,toolbar=no,resizable=yes,scrollbars=yes,height=600,width=600');return false;""><img src=""http://www.gstatic.com/images/icons/gplus-16.png"" alt=""Share on Google+""/></a> </div></p><p><a href=""http://news.slashdot.org/story/14/11/28/143200/volcanic-eruption-in-japan-disrupts-flights?utm_source=rss1.0moreanon&amp;utm_medium=feed"">Read more of this story</a> at Slashdot.</p><iframe src=""http://slashdot.org/slashdot-it.pl?op=discuss&amp;id=6220933&amp;smallembed=1"" style=""height: 300px; width: 100%; border: none;""></iframe><img width='1' height='1' src='http://slashdot.feedsportal.com/c/35028/f/647410/s/40eed671/sc/10/mf.gif' border='0'/><br clear='all'/><br/><br/><a href=""http://da.feedsportal.com/r/214612182851/u/0/f/647410/c/35028/s/40eed671/sc/10/rc/1/rc.htm"" rel=""nofollow""><img src=""http://da.feedsportal.com/r/214612182851/u/0/f/647410/c/35028/s/40eed671/sc/10/rc/1/rc.img"" border=""0""/></a><br/><a href=""http://da.feedsportal.com/r/214612182851/u/0/f/647410/c/35028/s/40eed671/sc/10/rc/2/rc.htm"" rel=""nofollow""><img src=""http://da.feedsportal.com/r/214612182851/u/0/f/647410/c/35028/s/40eed671/sc/10/rc/2/rc.img"" border=""0""/></a><br/><a href=""http://da.feedsportal.com/r/214612182851/u/0/f/647410/c/35028/s/40eed671/sc/10/rc/3/rc.htm"" rel=""nofollow""><img src=""http://da.feedsportal.com/r/214612182851/u/0/f/647410/c/35028/s/40eed671/sc/10/rc/3/rc.img"" border=""0""/></a><br/><br/><a href=""http://da.feedsportal.com/r/214612182851/u/0/f/647410/c/35028/s/40eed671/sc/10/a2.htm""><img src=""http://da.feedsportal.com/r/214612182851/u/0/f/647410/c/35028/s/40eed671/sc/10/a2.img"" border=""0""/></a><img width=""1"" height=""1"" src=""http://pi.feedsportal.com/r/214612182851/u/0/f/647410/c/35028/s/40eed671/sc/10/a2t.img"" border=""0""/><img src=""http://feeds.feedburner.com/~r/Slashdot/slashdot/~4/Ldu8HY3mULM"" height=""1"" width=""1""/>"
What Made the Bang so Big? (Discover Magazine),http://news.feedzilla.com/en_us/stories/science/409133359?client_source=api&format=json,"If the findings are verified, BICEP2 will have amassed the strongest support
yet for cosmic inflation.

"
"Without passing single law, Obama crafts bold environmental plan (ecoearth.info)",http://news.feedzilla.com/en_us/stories/science/409129516?client_source=api&format=json,"Age: President Barack Obama could leave office with the most aggressive, far-
reaching environmental legacy of any previous occupant of the White House. Yet
it is very likely that not a single major environmental law will have passed
during his two terms in Washington. Instead, Obama has turned to the vast
reach of the Clean Air Act of 1970, which some legal experts call the most
powerful environmental law in the world. Faced with a Congress that has shut
down his attempts to push through an environmental...

"
